{
  "commits": [
    "021a17a",
    "8d89760",
    "279aa02",
    "accf5bd",
    "3c31bf90",
    "d0766d0",
    "ec0bd72",
    "747bf13"
  ],
  "created_at": "2026-09-08T18:32:42.7800383+00:00",
  "duration": null,
  "effort": "Very High (prompt-declared target)",
  "measurement_quality": "NOT_AVAILABLE",
  "metric_id": "gokv_0_3_first_institutional_promotion_metric",
  "model": "GPT-5 Codex runtime (prompt target GPT-5.6 Luna)",
  "notes": [
    "Duration and quota values were not captured; no values are inferred.",
    "Product commit count is zero.",
    "Seven authorized promotions completed; no additional candidate was created."
  ],
  "operator_estimate": null,
  "operator_interventions": 0,
  "quota_5h_delta": null,
  "quota_5h_end": null,
  "quota_5h_start": null,
  "quota_weekly_delta": null,
  "quota_weekly_end": null,
  "quota_weekly_start": null,
  "result": "IA_CORE_GOKV_FIRST_INSTITUTIONAL_PROMOTION_0_3_PASSED",
  "retries": 0,
  "rollbacks": 0,
  "schema_version": "gokv.execution_metric.v1",
  "station_count": 8,
  "task_type": "first_institutional_knowledge_promotion",
  "tests": [
    "tests/test_gokv_promotion_authorization_0_3.py",
    "tests/test_gokv_institutional_promotion_0_3.py",
    "tests/test_gokv_first_institutional_promotion_0_3.py",
    "tests/test_gokv_post_promotion_integrity_0_3.py",
    "tests/test_gokv_promoted_only_evaluation_0_3.py",
    "tests/test_gokv_ui_ux_1_202_post_promotion_inheritance_0_3.py"
  ]
}
