{
  "commits": [
    "9387370"
  ],
  "created_at": "2026-09-08T14:57:03.567532+00:00",
  "duration": null,
  "effort": "Muy Alto (prompt-declared target)",
  "measurement_quality": "NOT_AVAILABLE",
  "metric_id": "gokv_0_2_n6_shadow_metric",
  "model": "GPT-5.6 Luna (prompt-declared target)",
  "notes": [
    "No duration, quota, cost, or reasoning-saved measurement was available."
  ],
  "operator_estimate": null,
  "operator_interventions": 0,
  "quota_5h_delta": null,
  "quota_5h_end": null,
  "quota_5h_start": null,
  "quota_weekly_delta": null,
  "quota_weekly_end": null,
  "quota_weekly_start": null,
  "result": "NO_LEARNING_FOUND",
  "retries": 0,
  "rollbacks": 0,
  "schema_version": "gokv.execution_metric.v1",
  "station_count": 1,
  "task_type": "microcopy_direction_decision_execution_preparation_shadow",
  "tests": [
    "tests/test_gokv_shadow_inheritance_0_2.py"
  ]
}
