{
  "metric_id": "roadmap_3_0_a_strategic_requirements_execution_metric",
  "schema_version": "gokv.execution_metric.v1",
  "model": "GPT-5.6 Luna",
  "effort": "Muy Alto",
  "task_type": "strategic_requirements_capture",
  "duration": null,
  "station_count": 8,
  "commits": [],
  "tests": ["tests/test_roadmap_3_0_a_strategic_requirements_capture.py"],
  "operator_interventions": 0,
  "retries": 0,
  "rollbacks": 0,
  "result": "ROADMAP_3_0_A_STRATEGIC_BUSINESS_WORKFORCE_MODEL_REQUIREMENTS_CAPTURE_PASSED",
  "quota_5h_start": null,
  "quota_5h_end": null,
  "quota_5h_delta": null,
  "quota_weekly_start": null,
  "quota_weekly_end": null,
  "quota_weekly_delta": null,
  "measurement_quality": "NOT_AVAILABLE",
  "operator_estimate": null,
  "notes": [
    "Exact start, end and duration were not captured; no duration is inferred.",
    "The existing Roadmap 2.x operator supplement remains historical and is not reused as 3.0.A telemetry.",
    "The mission performed no provider, network, runtime, execution, product or operational store action."
  ],
  "created_at": "2026-09-08T23:59:00Z"
}
