{
  "metric_id": "roadmap_3_x_macro_03_execution_metric",
  "schema_version": "gokv.execution_metric.v1",
  "model": "GPT-5.6 Luna - Muy Alto",
  "effort": "Muy Alto",
  "task_type": "roadmap_3_x_macro_03_frontier_reconstruction",
  "duration": null,
  "station_count": 7,
  "commits": ["83918905ff4f0e88416ef12c7d2c9e9b5057b192", "53f0c0cb93ce7fc23e51dae5705d4c9762f9daaf", "49952068b0ec8e6d03f0de77c213731632c41455"],
  "tests": ["tests/test_roadmap_3_x_macro_03_f004_family_decision_sufficiency.py", "tests/test_roadmap_3_x_macro_03_b7_and_roadmap_4x_entry.py", "tests/test_roadmap_3_x_macro_03_learning_reconciliation.py"],
  "operator_interventions": 0,
  "retries": 0,
  "rollbacks": 0,
  "result": "MACRO_03_DOCUMENTARY_READINESS_CAPTURED",
  "quota_5h_start": "69% remaining before Macro 02.2 reset sequence",
  "quota_5h_end": "89% remaining after reset and final Macro 02.2 observation",
  "quota_5h_delta": "NOT_COMPARABLE_RESET_INTERRUPTED",
  "quota_weekly_start": "95% remaining",
  "quota_weekly_end": "90% remaining",
  "quota_weekly_delta": "5 percentage points visible operator-reported change",
  "measurement_quality": "OPERATOR_REPORTED",
  "operator_estimate": {
    "source_mission": "ROADMAP_3X_MACRO_02_2",
    "wall_time": "3h 38m 05s",
    "operator_interruptions": 0,
    "internal_terminal_capture_loss": 1,
    "internal_terminal_capture_recovered": true,
    "weekly_start_remaining": 95,
    "weekly_end_remaining": 90,
    "weekly_visible_delta": 5,
    "five_hour_start_remaining": 69,
    "five_hour_observed_intermediate_remaining": 65,
    "five_hour_reset_observed": true,
    "five_hour_post_reset_start_remaining": 100,
    "five_hour_final_remaining": 89,
    "five_hour_measurement_quality": "RESET_INTERRUPTED",
    "final_suite_tests_collected": 6916,
    "final_suite_passed": 6910,
    "final_suite_failed": 0,
    "final_suite_skipped": 6,
    "historical_unique_nodes_reconciled": 173,
    "published_commits": 9,
    "provenance": "OPERATOR_REPORTED_FROM_MACRO_02_2_PROMPT_AND_CHECKPOINT_CONTEXT",
    "monetary_or_token_conversion": false
  },
  "notes": [
    "This metric records Macro 02.2 operator-reported measurements as inherited context for Macro 03.",
    "The five-hour values are separated by an observed reset and are not summed as one continuous scale.",
    "No current Macro 03 wall time or quota delta is fabricated.",
    "Verified responsibility per usage and autonomous wall time per usage remain descriptive candidate patterns, not commercial metrics.",
    "No provider, runtime, execution, product persistence, secret value or external traffic was used."
  ],
  "created_at": "2026-09-12T00:00:00+00:00"
}
