{
  "commits": ["be5986e0f8fd49a61694d2d8752bae20f0f52c52", "678910e119304cdc9cbbcd71ca0e72560c0f538d", "5fb046934ab764020b23dcf9a883b0e3a6896502", "fbbc5372865467c4c5de3c09e580644971e2d163"],
  "created_at": "2026-09-11T00:00:00+00:00",
  "duration": null,
  "effort": "Muy Alto",
  "measurement_quality": "NOT_AVAILABLE",
  "metric_id": "roadmap_3_x_macro_01_learning_adjudication_metric",
  "model": "GPT-5.6 Luna",
  "notes": ["This metric records governance and evidence state, not production throughput or runtime behavior."],
  "operator_estimate": null,
  "operator_interventions": 0,
  "quota_5h_delta": null,
  "quota_5h_end": null,
  "quota_5h_start": null,
  "quota_weekly_delta": null,
  "quota_weekly_end": null,
  "quota_weekly_start": null,
  "result": "CANDIDATE_ONLY_NO_AUTOMATIC_PROMOTION",
  "retries": 0,
  "rollbacks": 0,
  "schema_version": "gokv.execution_metric.v1",
  "station_count": 4,
  "task_type": "macro_01_learning_adjudication",
  "tests": ["tests/test_roadmap_3_x_macro_01_security_legacy_canonical_alignment.py", "tests/test_roadmap_3_x_macro_02_learning_adjudication.py"]
}
