{
  "commits": ["eb3a02f72be320a75d5a7501f2c059dba8e0c548", "1c07393b21cd3b4965e956da519ddfa71ce3eaf3", "975a54e5624512450903d9b94c380cbe57bad0f0", "c520d2a072c1435118113f7411fd862b008d3194", "6622289f09e8af28845427d0984706267cdfc6c6", "75b0d1eed5b169bc8bdfe35d3f5b67f37b2778c3", "1fdf1c444a5985c01658d6125377a0835849491e", "888527c0a2d58198e10df80d1ccc90673c1692e9", "a6af100df13665efefedf81388da1ebe177e5480", "588aeaaf99fda6e0c84174be753b8dc11d09e548", "b1b15e0605fe5efe4fbdc9dd2123f3d43199dc9d", "c258700a894fdb7a7962b89ed57b165ca799d3b0", "378ebd557f3191675b8708a77461f187ccaa3330", "74f1a366e954dbc041c10c0ee17d65e041bb1421", "24b0fecc23148c325a3f5577559e689c6e1872e9", "61a0eab30e88f06254c66adc7ca5de8d744e09e8"],
  "created_at": "2026-09-11T00:00:00+00:00",
  "duration": null,
  "effort": "Muy Alto",
  "measurement_quality": "NOT_AVAILABLE",
  "metric_id": "roadmap_3_x_macro_02_learning_loop_metric",
  "model": "GPT-5.6 Luna",
  "notes": ["Governance evidence only; no throughput, runtime, provider, network, or production metric was measured."],
  "operator_estimate": null,
  "operator_interventions": 0,
  "quota_5h_delta": null,
  "quota_5h_end": null,
  "quota_5h_start": null,
  "quota_weekly_delta": null,
  "quota_weekly_end": null,
  "quota_weekly_start": null,
  "result": "NO_NEW_CANDIDATE_REFINEMENT_CAPTURED",
  "retries": 0,
  "rollbacks": 0,
  "schema_version": "gokv.execution_metric.v1",
  "station_count": 10,
  "task_type": "macro_02_learning_loop",
  "tests": ["tests/test_roadmap_3_x_macro_02_learning_loop.py"]
}
