{
  "commits": ["473e4ef9", "fb341dbc", "9b11adfa", "e18a9fad"],
  "created_at": "2026-09-08T20:04:24.1913927Z",
  "duration": null,
  "effort": "Muy Alto",
  "measurement_quality": "NOT_AVAILABLE",
  "metric_id": "ui_ux_1_203_deterministic_visual_terrain_hardening_execution_metric",
  "model": "GPT-5.6 Luna",
  "notes": [
    "Duration and quota values were not captured; no values are inferred.",
    "Product changes were limited to two measured scoped CSS corrections.",
    "Canonical current group passed 92 tests; historical snapshot mismatches were recorded separately."
  ],
  "operator_estimate": null,
  "operator_interventions": 0,
  "quota_5h_delta": null,
  "quota_5h_end": null,
  "quota_5h_start": null,
  "quota_weekly_delta": null,
  "quota_weekly_end": null,
  "quota_weekly_start": null,
  "result": "UI_UX_DETERMINISTIC_VISUAL_TERRAIN_HARDENING_1_203_PASSED",
  "retries": 0,
  "rollbacks": 0,
  "schema_version": "gokv.execution_metric.v1",
  "station_count": 6,
  "task_type": "deterministic_visual_terrain_hardening",
  "tests": [
    "tests/test_ui_ux_1_203_deterministic_visual_terrain_hardening.py",
    "tests/test_ui_ux_1_202_selection_checkpoint.py",
    "tests/test_gokv_ui_ux_1_202_post_promotion_inheritance_0_3.py"
  ]
}
