{
  "metric_id": "roadmap_3_x_macro_02_1_learning_reconciliation_metric",
  "schema_version": "gokv.execution_metric.v1",
  "model": "GPT-5.6 Luna",
  "effort": "Muy Alto",
  "task_type": "macro_02_1_learning_reconciliation",
  "duration": null,
  "station_count": 7,
  "commits": ["9747ebb", "e2eedb8", "effdcd2", "d95ffba"],
  "tests": ["tests/test_roadmap_3_x_macro_02_1_hermetic_validation.py", "tests/test_roadmap_3_x_macro_02_1_phantom_side_effects.py", "tests/test_roadmap_3_x_macro_02_1_legacy_alignment.py"],
  "operator_interventions": 0,
  "retries": 0,
  "rollbacks": 0,
  "result": "THREE_CANDIDATES_RECORDED_NO_AUTO_PROMOTION",
  "quota_5h_start": null,
  "quota_5h_end": null,
  "quota_5h_delta": null,
  "quota_weekly_start": null,
  "quota_weekly_end": null,
  "quota_weekly_delta": null,
  "measurement_quality": "NOT_AVAILABLE",
  "operator_estimate": null,
  "notes": ["Governance evidence only; no provider, runtime, network, or production metric was measured.", "Reused knowledge IDs: focal_group_canonical_deep_test_policy, local_rollback, station_local_commits, real_diff_over_planned_commit_name.", "New candidates remain CANDIDATE and require future independent validation."],
  "created_at": "2026-09-11T00:00:00+00:00"
}
